{
  "protocol_version": "2.0.0-draft",
  "message_kind": "transcode.result.completed",
  "message_id": "99999999-9999-7999-8999-000000000145",
  "sent_at": "2029-12-31T23:59:55.000Z",
  "audience": "hub:cell-test-a",
  "key_id": "test-wk2hub-k1",
  "identity": {
    "org_uuid": "11111111-1111-7111-8111-111111111111",
    "video_uuid": "22222222-2222-7222-8222-222222222222",
    "owning_cell_id": "cell-test-a",
    "placement_epoch": 7,
    "lifecycle_revision": 3,
    "attempt_id": "22222222-2222-7222-8222-222222222222",
    "dispatch_id": "44444444-4444-7444-8444-444444444444",
    "execution_id": "55555555-5555-7555-8555-555555555555",
    "execution_fence": 2
  },
  "generation_id": "55555555-5555-7555-8555-555555555555",
  "manifest": {
    "location_id": "bbbbbbbb-bbbb-7bbb-8bbb-bbbbbbbbbbbb",
    "path": "generation-manifest.json",
    "sha256": "6f380599ad097e2c0013d96b398116142c7c0b25d1d8d2dd6097d71d7b913a4d",
    "size_bytes": 4144,
    "artifact_count": 11,
    "total_bytes": 6391664
  },
  "source": {
    "source_id": "66666666-6666-7666-8666-666666666666",
    "bytes_read": 734003200,
    "etag_observed": "test-etag-0001"
  },
  "profile": {
    "id": "test-h264-sdr",
    "version": 1,
    "sha256": "abababababababababababababababababababababababababababababababab"
  },
  "media": {
    "duration_ms": 12000,
    "max_width": 1280,
    "max_height": 720,
    "has_audio": true,
    "rendition_count": 3
  },
  "encoder": {
    "image_digest": "sha256:cdcdcdcdcdcdcdcdcdcdcdcdcdcdcdcdcdcdcdcdcdcdcdcdcdcdcdcdcdcdcdcd",
    "ffmpeg_version": "7.1-test",
    "video_encoder": "libx264",
    "preset": "medium"
  }
}
